id,created_at,text
b'1007996073338724352',06/16/2018,"b""Great indicator, though people need to keep in mind that it's a number that continuously changes/should be monitore\xe2\x80\xa6 https://t.co/jYKYp37sob"""
b'1006233635698208768',06/11/2018,"b'RT @byrongibson: #BPASE18 talk slides/papers/videos up: https://t.co/VRx24ms9UN Thanks all who attended, sponsored, organized and the PC fo\xe2\x80\xa6'"
b'999388720875917314',05/23/2018,b'Institutional Custody in the Crypto World https://t.co/kUoo1ZgLeR'
b'997197259145170944',05/17/2018,b'Laws of Tech: Commoditize Your Complement - Great piece explaining open source and tech biz in general https://t.co/K2d3AMnK3Z'
b'995867875444449280',05/14/2018,b'The State of Cryptocurrency Mining - must read from David of Obelisk about Asic manufacturing https://t.co/88hUV6PBu9'
b'987105588579618818',04/19/2018,b'2 papers - Perun: no intermediary w/ payment routing via \xe2\x80\x9cchannel virtualization\xe2\x80\x9d + gen state channel specification https://t.co/xzvlZmWWpI'
b'979006602190708736',03/28/2018,"b""Low-Resource Eclipse Attacks on #Ethereum's P2P Network. Note: countermeasures addressed in Geth 1.8 https://t.co/EI7gLPw7zM"""
b'972510264590589952',03/10/2018,b'Concepts/MVPs I\xe2\x80\x99m watching closely in 2018: 1) stable coins 2) generalized state channels 3) probabilistic payment\xe2\x80\xa6 https://t.co/wJbXASJWJm'
b'966849027345145857',02/23/2018,b'Self-owning corporations are legally possible - DAO is real! https://t.co/3fNO5WlXgb'
b'955843893794308096',01/23/2018,b'Gov of Canada uses #ethereum to keep track of/make transparent government spending. One of the few great &amp; intended\xe2\x80\xa6 https://t.co/JL8m3KGT7S'
b'951595586448486400',01/11/2018,b'Whitepaper on zkStark https://t.co/onF0AswtQD'
b'938883103619211265',12/07/2017,"b'@jeffehh Sad, I was GavCoin HODLer'"
b'924472289785188353',10/29/2017,b'@OrchidProtocol 1)dependency on ethererum/light client=less censor proof 2)topology eventually becomes centralized.\xe2\x80\xa6 https://t.co/QXQJbiptub'
b'923572761393549313',10/26/2017,b'Startup @orchidprotocol is building incentivized Tor/decentralized VPN. Great for Internet. Very important work! https://t.co/5xdMQmoXec'
b'919951103135010822',10/16/2017,"b'KRACK breaks WPA2 - srs attack, affects clients on WIFI networks. Via all-0 encrypt key/sslstrip, get login info. https://t.co/P6l0ip8WhW'"
b'915612646338174978',10/04/2017,b'Cooley/ProtoLabs hacked this SAFT paper together. Mission: legalize token sales &amp; ICOs + follow US security laws https://t.co/SRWJwUBjGM'
b'909819968413462529',09/18/2017,b'PassGAN: AI password cracker - 1 neuronet invents passwords + another judges - 2x more efficient than JTR\xe2\x80\x99s rules. https://t.co/B6ohTamn55'
b'908003230688448512',09/13/2017,"b'Zcash protocol upgrade \xe2\x80\x9cSapling\xe2\x80\x9d - Proof time ~7s, memory usage &lt;30MB from 3GB, possible w/ phones? Github: jubjub https://t.co/1mXbg82o4H'"
b'900068952109445120',08/22/2017,"b'Estcoin: 1st gov backed token. From eVote to 5-min tax to early STEM, Estonia = epitome of innovations in government https://t.co/Rjdtzh8w7S'"
b'889897065479892994',07/25/2017,b'\xe2\x80\x9cThis Is How Your Fear and Outrage Are Being Sold for Profit\xe2\x80\x9d by @TobiasRose https://t.co/8EIE1uAcUw'
b'879363989351919617',06/26/2017,"b'How HBO\xe2\x80\x99s Silicon Valley built \xe2\x80\x9cNot Hotdog\xe2\x80\x9d with mobile TensorFlow, Keras &amp; React Native: 1 developer+macbook+gpu https://t.co/Ia8X3JSAkL'"
b'876545270682718217',06/18/2017,"b'For those who are confused about ""blockchain"".. what it means, where/when/how to use it: https://t.co/AdUfUSbOsz'"
b'874717774630834177',06/13/2017,"b'With deep learning, how important is it to understand the reasoning behind decisions made by AI? https://t.co/pxpC808WLu'"
b'869988166442393600',05/31/2017,b'Check out the projects of the 2017 AI grant fellows: https://t.co/mEn7fWZHfg'
b'864934603588587520',05/17/2017,b'I just published \xe2\x80\x9cOn Fundraising\xe2\x80\x9d https://t.co/0wwoX5h4f0'
b'856876042530828288',04/25/2017,b'On Growing: 7 Lessons from the Story of WeChat via YC https://t.co/WvRt4hG2B5'
b'853292285034995712',04/15/2017,"b'ShadowBrokers: The NSA compromised the SWIFT Service Bureaus (EastNet &amp; BCG, possibly a lot more) https://t.co/xrq7q5TNvG'"
b'851829507472470017',04/11/2017,b'Can \xe2\x80\x9cDigital Therapeutics\xe2\x80\x9d Be as Good as Drugs? https://t.co/EkMwjNDXc1'
b'841321200995434496',03/13/2017,b'On Angel Investing https://t.co/5LaXPiTBCv'
b'839126313214562305',03/07/2017,"b'First 3D printed residential tiny house in Russia, costs $10k, finished on-site in 24 hours! https://t.co/DaT7dWx5Hg'"
b'832310079953186816',02/16/2017,b'Gates Foundation\xe2\x80\x99s 2017 annual letter on what they\xe2\x80\x99ve achieved in the past decade. https://t.co/uwBj87AYug'
b'828662221362311168',02/06/2017,b'Russian Hackers broke slot machines by timing the spins from their knowledge of the psudorandom generator. No fix https://t.co/xxHdVc714W'
b'818839078384893952',01/10/2017,b'Dr. Hanley electroperates himself w/ human GHRH plasmids: self experiment to combat aging/enhance immune system https://t.co/y1Vcwf4xJZ'
b'814160100822806533',12/28/2016,"b'A part time job to research before starting a business = best advice. Humility + learning, not pride. @jasonfried https://t.co/u82IVupul9'"
b'813789687349477376',12/27/2016,b'All-electric Quadrofoil will soon allow you to fly on water \xe2\x80\x93 WANT! https://t.co/q4oOA3kP82'
b'811603015408959488',12/21/2016,b'Biggest Ad Fraud Ever: Russian Hackers Make $5M A Day By Faking 300M Video Views via a botfarm dubbed Methbot https://t.co/FvI0TSFIv0'
b'786582114087075841',10/13/2016,b'Analysis of massive DDoS attacks coming from IoT cameras by @cloudflare https://t.co/cacbbBUSb8'
b'770615054328819712',08/30/2016,b'This one-yr case study is absolute gold for any startup founder who wants to understand his/her own time management https://t.co/uHzLFrMwm9'
b'770290232600264704',08/29/2016,b'A great piece by @a16z on How Startup Options (and Ownership) Works https://t.co/xrt3HpUuEW'
b'759580466949267456',07/31/2016,"b'How Magic Leap, one of the best funded startup/VR super unicorn, works https://t.co/qLfm5WzO18'"
b'737427321007833089',05/30/2016,b'The government should take a field trip to Silicon Valley instead: https://t.co/Km4Xnp2j8D'
b'729008221231403008',05/07/2016,b'Why wind turbines have three blades? https://t.co/k7toEjoGMZ'
b'725537595136958464',04/28/2016,"b""In case you didn't know what it's like to work at a SF tech startup, now you know: https://t.co/LyEicIbQVr"""
b'724629120743690240',04/25/2016,b'Bank of Japan Is Now a Top 10 Holder in 90% of Japanese Stocks https://t.co/GicpNeiYHZ'
b'712172354676260868',03/22/2016,b'Universities Are Becoming Billion-Dollar Hedge Funds With Schools Attached https://t.co/9ng8elxYdq'
b'697118373352607745',02/09/2016,b'In-depth analysis of the insurance industry (mainly EU) by @robmoff https://t.co/lKuITHrUba'
b'696617361764278273',02/08/2016,"b'Alec Ross comparing Estonia &amp; Belarus\xe2\x80\x99 innovations: e-voting, 5-min tax returns, e-residency, 1st grade coding class https://t.co/Py1kMJ8CzA'"
b'682619680117387265',12/31/2015,b'\xe2\x80\x9cBitcoin is Being Hot-Wired for Settlement\xe2\x80\x9d by @jgarzik https://t.co/3wIvE6ZmZK'
b'676317666139766784',12/14/2015,"b'Dubbed \xe2\x80\x9cBootrash\xe2\x80\x9d, this bookit infects MBR and is installed on the empty space btw partitions. Loads before Windows https://t.co/P1JBjGpLNp'"
b'672508327658590208',12/03/2015,b'~$30 + old xbox controller = complete gaming system. Pi Zero in controller hack @edent https://t.co/QC0YcF7GYB'
b'671985987027795969',12/02/2015,b'Unicorns vs. Donkeys: Handy Guide to Distinguishing by @abhasvc  https://t.co/LfP2M4kCdT'
b'661277691165831169',11/02/2015,b'How an episode of The Simpsons is made https://t.co/8aNjakFKYQ'
b'657317445460332544',10/22/2015,b'From Outsourcing Your Life to Full Automation: https://t.co/skKDzsin6d'
b'655085375287771136',10/16/2015,b'How to Protect Yourself from NSA Attacks on 1024-bit DH https://t.co/rOD5qryogD'
b'647193800570368000',09/24/2015,b'Coinbase\xe2\x80\x99s 9-patent submission to USPTO http://t.co/ybmSdWl6Hx'
b'633023306409447424',08/16/2015,b'Guy with a Ham Radio License chats with an astronaut on ISS for 45 seconds http://t.co/pHNZDqcLTP'
b'628706814926848000',08/04/2015,"b""Everyone's having fun at http://t.co/hkDu9bOhNE's expense today. Greg Maxwell got 21MM bitcoins! Haha http://t.co/Duws2FYz5n"""
b'626819897612333056',07/30/2015,b'Ethereum launched Frontier: https://t.co/Yqj224MrpT'
b'619981413312430080',07/11/2015,b'How does Shazam work http://t.co/4IY4ESqePl'
b'617942760138543105',07/06/2015,b'China\xe2\x80\x99s Stock Market Rout is a Double Threat http://t.co/jb8PQJtDF2'
b'608418346686623745',06/09/2015,b'Blockstream/Greg Maxwell\xe2\x80\x99s Confidential Transactions: best/cleverest from their announcement of Elements https://t.co/3bcGzDPELq'
b'600537263697625088',05/19/2015,b'@jgarzik @DollarJones @gavinandresen @petertoddbtc This man has 9 of these in one of his many factories across China. http://t.co/y9DtiIPSvn'
b'600449118452879360',05/18/2015,b'Welcome the Botnet 2.0: https://t.co/dqnBOEVhto'
b'598414742521192448',05/13/2015,b'Richard Brown: World of \xe2\x80\x9cblockchains\xe2\x80\x9d is actually two worlds - Permissionless vs. Permissioned http://t.co/pg4pNFi1Im'
b'597106613216907264',05/09/2015,b'Gavin: Why increasing the max block size is urgent http://t.co/NK9aedomY1'
b'593123000674701313',04/28/2015,b'How Quantum Pairs Stitch Space-Time  https://t.co/Ozpje80DaN'
b'586606293818847233',04/10/2015,"b""China's Great Cannon: analysis on recent DDOS on Github  https://t.co/xrGXR2Y8XI"""
b'584204542947917824',04/04/2015,b'The Cuban Money Crisis http://t.co/r51Lzzr9T8'
b'582616657962491904',03/30/2015,"b'Complaint about FBI Agents working on DPR case: shell companies, forge letters, offshore investments. So Hollywood!  http://t.co/tfnBap0RG5'"
b'579051589429657601',03/20/2015,b'Detailed description of dll hijacking on OS X! NSA flash installer = nice touch ha! Gatekeeper bypass+MITM download https://t.co/3Ght6aOjjn'
b'572976671151788032',03/04/2015,"b'TLS FREAK Attack, victims include american express, groupon, bloomberg, kohls\xe2\x80\xa6 https://t.co/GMG7hlVqCx'"
b'571247515640598528',02/27/2015,"b""How to scale Bitcoin to 7 billion people? Lightning Network is one of very few great ideas since Satoshi's whitepaper http://t.co/IgPXp0Fsmr"""
b'566158544148242432',02/13/2015,b'Online Algorithms in High-Frequency Trading http://t.co/R1PDwYfVwi'
b'565222548947103744',02/10/2015,b'Microsoft Research on Byzantine Consensus. One of the most entertaining papers from Microsoft for sure! http://t.co/7G76ad6e8s'
b'562737108943925253',02/03/2015,b'Underside of an iceberg: http://t.co/qHDedHFJIl'
b'561301936667127809',01/30/2015,b'University of Warsaw - On Bitcoin Malleability http://t.co/GMSR4AfBj4'
b'561277471803596801',01/30/2015,b'Air-Gapped Computers Compromised Using EM Side-Channel Attacks @gtcomputing Paper was somewhat disappointing tbh http://t.co/a0i0dXrjoo'
b'561092056001429507',01/30/2015,"b'In 3 years, fraud researchers invested $147k, returned $1.76 mil (1819%), option trading via querying internal db http://t.co/oKYH8R0IEb'"
b'560248594402664448',01/28/2015,b'Fed\xe2\x80\x99s strategies to improve current payment system https://t.co/kMXZppGB0F'
b'559455568243326976',01/25/2015,b'\xe2\x80\x9cPoor people don\xe2\x80\x99t plan long-term. We\xe2\x80\x99ll just get our hearts broken\xe2\x80\x9d http://t.co/bUr7Hk9TwY'
b'555460352549588992',01/14/2015,b'Bip 62 only solves 3rd party malleability. I was referring to something more interesting re my previous tweet :) @alness'
b'555458975878381568',01/14/2015,"b'Tadge talks about Malleability (the REAL threat) and a soft fork to fix it, MUST WATCH: https://t.co/0qXN2CUZsQ'"
b'552544074545508353',01/06/2015,b'Secure Secure Shell: \xe2\x80\x9cMy goal with this post here is to make NSA analysts sad\xe2\x80\x9d :) https://t.co/js9GuSyyrj'
b'548055818068033536',12/25/2014,b'Web Encryption: 2014 in Review https://t.co/oAE7jClN2X'
b'543874272033529856',12/13/2014,b'A Novel Approach For Computer Worm Control Using Decentralized Data Structures https://t.co/yq4EoPmWqN'
b'541041288519221248',12/06/2014,"b'Stellar had a fork... Solution? ""We will now resort to an one-validator-node consensus system""  https://t.co/QzN7NTZIMU'"
b'540669738196545536',12/05/2014,"b'With malleability, you really cannot do anything too interesting with Bitcoin. This really should to be fixed ASAP.'"
b'539364279280218112',12/01/2014,b'Great Works in Programming Languages  http://t.co/QykYU6W3Hl'
b'532990250222510081',11/13/2014,"b""Counterparty integrated Ethereum? Ethereum hasn't integrated Ethereum yet..."""
b'530799737788968962',11/07/2014,"b'High frequency ads arbitraging, not news, but mind-boggling numbers http://t.co/8prEQ0YTFV'"
b'530438241246519299',11/06/2014,"b'Blake aka Defcon arrested, silkroad 2.0 operator, another SF guy. http://t.co/FaZ4IxW17F'"
b'528254394614448128',10/31/2014,"b'Virgin Galactic\xe2\x80\x99s SpaceShipTwo crashes shortly after Mojave test flight, 1 fatality. http://t.co/RoTjAZvpfo'"
b'525103182553182211',10/23/2014,b'Enabling Blockchain Innovations with Pegged Sidechains  http://t.co/Y5h2PLxwc4'
b'523871929762320384',10/19/2014,"b'Disney renders \xe2\x80\x9cBig Hero 6\xe2\x80\x9d on a 55,000-core super computer. http://t.co/1zhOiynwbC'"
b'522080008991670272',10/14/2014,b'Andrew Sorensen programs live music in Extempore (mixture of lisp &amp; C) https://t.co/RDU4Kd3grS'
b'521386466039975936',10/12/2014,b'IPFS: The Permanent Web http://t.co/mQ087jN67I'
b'520088853584297985',10/09/2014,b'What kids around the world eat for breakfast  http://t.co/NEtQVMQI7g'
b'517366411157864448',10/01/2014,b'Common attacks from the recent Shellshock bug: https://t.co/ztOmMpVVlc'
b'517126866050613248',10/01/2014,b'How RAM Scrapers Work: The Tool Behind the Latest Credit Card Hacks http://t.co/QenZkcRwQ6'
b'514482708462833664',09/23/2014,b'This is why the bitcoin price jumped like 10% today? http://t.co/wXHAQS3Y7x via @coindesk'
b'514255998052102145',09/23/2014,"b""MIT Students Battle State's Demand for Their Bitcoin Miner's Source Code. Seriously? Aaron Swartz all over again.  http://t.co/73mLr73lx5"""
b'513996638524682240',09/22/2014,b'An Insider\xe2\x80\x99s Account of the Yahoo-Alibaba Deal http://t.co/c11S09RBbN'
b'512660545728565248',09/18/2014,"b""VC on convertible notes and why it's bad  http://t.co/a3pBlcufai"""
b'511950065427296256',09/16/2014,"b'Byron: Draper Coin blockchain - it\'s earning ""interest"" as people send tiny donations in order to leave a comment. https://t.co/8cyA4J4m4O'"
b'510189032668528640',09/11/2014,"b'Cryptomarkets are gentrifying the drug trade, and that\xe2\x80\x99s probably a good thing: https://t.co/myJgYJwQwX'"
b'510187588196786176',09/11/2014,b'Another case for the tiny home movement - Professor lives in a dumpster on campus: http://t.co/ap6XBWSTYC'
b'509830070090092544',09/10/2014,b'IBM\xe2\x80\x99s internet of things architecture: 1) Blockchain 2) DHT 3) BitTorrent http://t.co/ZhG0fdWHY8'
b'508198673801424896',09/06/2014,b'The FBI Finally Says How It \xe2\x80\x98Legally\xe2\x80\x99 Pinpointed Silk Road\xe2\x80\x99s Server http://t.co/yIpfGMos5O'
b'507788250077872128',09/05/2014,b'Secret Network Connects Harvard Money to Payday Loans http://t.co/wn6qBXtwqH'
b'507365773749141504',09/04/2014,b'Lending Club Can Be a Better Bank Than the Banks  http://t.co/TSone6BgNz'
b'505404415600111616',08/29/2014,"b""Inside One of the World's Largest Bitcoin Mines - 5% of all hashing power http://t.co/LYyOThLujX"""
b'505181860419223552',08/29/2014,b'remember Hal Finney: https://t.co/IhZ1P2Zm96'
b'504122516307066880',08/26/2014,b'Teaching machines to read between the lines (and a new corpus with entity salience annotations) http://t.co/hsvSBV5V4h'
b'502736585314426880',08/22/2014,b'What Lies Beneath Stonehenge? http://t.co/M0X1cKRigm'
b'500335713200914432',08/15/2014,b'An amateur linguist loses control of the language he invented (2012) http://t.co/BR56jvhl5l'
b'499316458393178112',08/12/2014,b'How come nobody realizes what a huge deal this is?! Bitcoin scaling issue doesn\xe2\x80\x99t interest anyone? https://t.co/uhhvF1qrZv'
b'498884969012666368',08/11/2014,b'Distributed systems theory for distributed systems engineer http://t.co/GqPI0wqfRA'
b'498777618658127872',08/11/2014,b'first-person hyperlapse videos http://t.co/kpKc91z5E9'
b'498371748870369282',08/10/2014,"b""Let me know what you think about Tadge's I/O proof of work - HASHIMOTO: https://t.co/DfePT3Ycwy #bitcoin #Ethereum"""
b'497903490958499840',08/09/2014,"b'Judge rejects $324.5M settlement over Apple, Google adobe class action lawsuit. Reason: number too low.  http://t.co/kwYV1NWb6f'"
b'497778830694576129',08/08/2014,b'How to Use Your Cat to Hack Your Neighbor\xe2\x80\x99s Wi-Fi http://t.co/PNy0exHDxS'
b'497309106147835904',08/07/2014,"b'@mifreewil go to sleep Sean, stop wasting time on twitter!'"
b'497295289338707968',08/07/2014,b'kvm vs. docker comparison: http://t.co/LEEMroBYfR .. source code at: https://t.co/JXTCJDXbwi'
b'496754869261570048',08/05/2014,"b'@mattetti @sandofsky I work in the area, but only went in after I started watching Silicon Valley'"
b'496733317115699200',08/05/2014,b'Discussion about bitcoin deterministic transaction expiration: http://t.co/KrkrhRYlWk'
b'496724895783747584',08/05/2014,b'Neglected machine learning ideas  https://t.co/vbDEHblVKl'
b'496542482532806656',08/05/2014,b'Banks lure fintech startups with venture funds http://t.co/wn7EFkm9ke'
b'495662858110119937',08/02/2014,"b""RT @kgreenek: Here's a fun spreadsheet: Bitcoin Venture Capital Funding --&gt; http://t.co/VEW89oaOBM"""
b'494898475071311872',07/31/2014,"b'Jed\'s new ""secret bitcoin project"": Stellar! Like ripple 1.01 funded by stripe:  https://t.co/pdkAAup199'"
b'494681950477504512',07/31/2014,b'NomadList \xe2\x80\x93 The best cities to live and work remotely in http://t.co/gHNGefQnec'
b'494398003885535232',07/30/2014,b'@kgreenek goswift is really happening!'
b'494373371434381312',07/30/2014,b'C and Go without CGO http://t.co/VMQEOKGcYr'
b'493643840469733379',07/28/2014,b'Black holes might end their lives by transforming into their exact opposite  http://t.co/ytumsB9Jsg'
b'493254518390267905',07/27/2014,b'The New York Times Calls for Marijuana Legalization http://t.co/e94G6Ooikk'
b'492229422661922816',07/24/2014,"b""India's smart shoe vibrates when you need to turn http://t.co/4eyrJ88lUN"""
b'491843092048130048',07/23/2014,b'Minimum Viable Block Chain https://t.co/4Zuyy7USvI'
b'491357323047084032',07/21/2014,b'Ripple Labs Unveils Proposal for New Smart Contract System http://t.co/fYrekKQstC'
b'491289552771104769',07/21/2014,b'Bitcoin: the Stripe perspective https://t.co/2KVQbuS0Y3'
b'490599427527032832',07/19/2014,"b'Identifying backdoors, attack points, and surveillance mechanisms in iOS devices http://t.co/sTFiExguoq'"
b'490178498892288000',07/18/2014,b'Dell Now Accepts Bitcoin http://t.co/i2sIfrr8NE'
b'490036388117483520',07/18/2014,b'The real 10 algorithms that dominate our world https://t.co/Bq5CXw3Hvu'
b'489934543286063104',07/18/2014,"b'@JordanSteeves Hey! Sadly I stopped working on it when I was applying to YC. Not finished, can be turned into a server pretty easily'"
b'489844501372866561',07/17/2014,"b'@EtherCasts waterfall: http://t.co/F4UE4XIGpU way to go, Joris!'"
b'489668029387509760',07/17/2014,"b'Gotta love hackers, free use of land for cool projects (real life farmville!):  https://t.co/FHpr9Hcxw6'"
b'489297890230009856',07/16/2014,"b""@sge55 IMO it's a huge abuse of power by the devs, even though they did get the coins back. It sets a bad precedence."""
b'489297281238052864',07/16/2014,"b'@FutureMoneyTren afaik, nobody knows how mtgox got ""hacked"" yet :) but I don\'t believe it\'s SQL Injection'"
b'489114394744606720',07/15/2014,b'MintPal lost 30% (8 mil) of Vericoins due to SQL injection? wtf\xe2\x80\xa6 http://t.co/N90yVC1TAS'
b'488223820168175617',07/13/2014,b'Four Technologies that will Revolutionize Financial Services http://t.co/5GFNhs3X6v'
b'488104606816149504',07/12/2014,b'Kryptoradio \xe2\x80\x93 A Bitcoin data transmission system http://t.co/rugNBUTMwJ'
b'487511827429879808',07/11/2014,b'The hunt for life beyond earth http://t.co/eiysxUhmsM'
b'487380093333819392',07/10/2014,"b'Opposite of current Proof of Works: puzzles are easy to generate, but hard to solve - wonder what we can use it for http://t.co/LWEYdi41WX'"
b'487105669971992576',07/10/2014,"b'Discussions: Hyperledger, a more centralized payment protocol https://t.co/RR56CVQuli'"
b'486977657775484928',07/09/2014,"b'Solitude not only improves creativity, productivity, but also empathy http://t.co/YFCrY6Hz48'"
b'486565018314743808',07/08/2014,b'RT @ethereumproject: Vitalik Buterin (@VitalikButerin) on Proof of Stake in a new ethereum blog post: https://t.co/5jtZns1cDC'
b'486414871752237057',07/08/2014,"b'lol wat? Fujitsu, Toshiba are now growing veggies in factories.. \xe2\x80\x9cStarting tomorrow, you are going to make lettuce.\xe2\x80\x9d http://t.co/omzunbt3Cd'"
b'486253359650054144',07/07/2014,"b'Bitcoin 0.10 switching to flexible fees. One down, many more to go https://t.co/Gf3pXOf7vF'"
b'485870922792845312',07/06/2014,"b""Hong Kong's subway engineers work for an AI boss.  http://t.co/qDWqQ9c3hj"""
b'484957921378172928',07/04/2014,b'O Shit!!!! TJ left node?! https://t.co/zuLtHt54y5'
b'484843785369559041',07/03/2014,"b""Lamport's paper on Time, clocks, order of events on distributed systems. http://t.co/9eRU0gRhZg"""
b'484444170804035584',07/02/2014,b'Draper\xe2\x80\x99s Bitcoin Press Conference Live Stream: http://t.co/jDpWWL49hF'
b'484389203820957696',07/02/2014,b'Mike Hearn is releasing LightHouse in Aug? What\xe2\x80\x99s going on with @swarmcorp? http://t.co/fNeTYRMZQQ'
b'484366253646032896',07/02/2014,b'Coinbase introduces Vault http://t.co/REVWeTczuc'
b'484366196691570688',07/02/2014,b'Venture Capitalist Tim Draper Wins Bitcoin Auction http://t.co/V9MeuZZWOc'
b'484287449376370690',07/02/2014,b'BitAuth for Decentralized Authentication http://t.co/u5u21cPR0e'
b'483653107901952000',06/30/2014,b'Detailed analysis of how the wealthy shield their wealth in NY real estate. http://t.co/CBCnATtZXc'
b'483508664460779522',06/30/2014,b'Write 225 words/min with Gregg shorthand! http://t.co/Hp1X4rOam3'
b'482296466572984321',06/26/2014,b'@gavofyork on \xc3\x90Apps: What Web 3.0 Looks Like http://t.co/8l44ys8vAE'
b'481869896880766976',06/25/2014,"b'Proof of Activity: extending bitcoin POW via POS - Iddo Bentov, Charles Lee, Alex Mizrahi, and Meni Rosenfeld http://t.co/nw05S8ipeb'"
b'481604832122650624',06/25/2014,"b'CUCKOO: proof of work, finding len-42 cycles makes it memory hard. Verification takes ~70 bytes. https://t.co/Rsk2MPkBxz'"
b'481134475451965443',06/23/2014,"b""Halsey Minor's New Payments Platform Bitreserve = using bitcoin as ripple? why would anyone pay 0.75% for that? http://t.co/rCOLY35Gbp"""
b'481111183093551105',06/23/2014,b'Eigenmorality - using the underlying principle Of Clever and PageRank to judge morality http://t.co/BBbxe6IdB2'
b'480126285801213952',06/20/2014,b'On Mining https://t.co/Uw5WTEdClN'
b'480064781656002560',06/20/2014,b'On Startup Valuations - Sam Altman http://t.co/mn9971oNCj'
b'479840331488174080',06/20/2014,"b'MIT loves Bitcoins, launching first ATM http://t.co/nzyHVndvUd'"
b'479658531377799172',06/19/2014,b'Show HN: Dead simple Bitcoin payroll http://t.co/Rd9c3vVEI6'
b'478960553134927872',06/17/2014,b'Javascript Cryptography - Matasano Security http://t.co/RxqzyY0E7Z'
b'478820153681924097',06/17/2014,b'Andreessen: Turn Detroit into Drone Valley http://t.co/zIEBqbY4dk'
b'478819055227248640',06/17/2014,b'Machine Learning for Risk at AirBnB http://t.co/wFHlOZiHBd'
b'478597193256169473',06/16/2014,b'DAO proposal https://t.co/rgoqwMj6so'
b'478392080301948929',06/16/2014,b'Smashing Swift http://t.co/qQkYb7Z9sa'
b'477552014436880384',06/13/2014,b'Discussion on GHash\xe2\x80\x99s 51% control over bitcoin blockchain https://t.co/IuhPLvoS2F'
b'477232400120832001',06/12/2014,b'Neutrino: litecoin with Tor http://t.co/NTn3blRq67'
b'476804846742679552',06/11/2014,b'Gold-Dispensing ATM http://t.co/8fgilyJW4R'
b'476760925018394625',06/11/2014,b'Expedia Starts Accepting Bitcoin for Hotel Bookings http://t.co/kC6kOxVMUz'
b'476405273721307136',06/10/2014,b'Gavin Andresen\xe2\x80\x99s Bitcoin 2.0 without Ethereum http://t.co/Dp4LewBrPv'
b'475367645156368384',06/07/2014,b'How dispatch_once work: https://t.co/rhiHGibKqH'
b'474867336009097216',06/06/2014,"b""Xiaomi's journey to success http://t.co/TmxMW9MYc3"""
b'474746632433434625',06/06/2014,b'TorCoin https://t.co/pGJN9FyeAr'
b'474733960661307392',06/06/2014,"b'Lang comparison: C++ 11, Java 8, JS http://t.co/xg8IxLOie7'"
b'473861369377218560',06/03/2014,b'SEC Charges Bitcoin Entrepreneur For Share Offering http://t.co/aGjmYT4uq5'
b'473662437950910464',06/03/2014,b'Swift \xe2\x80\x93 observations from Rust\xe2\x80\x99s original designer http://t.co/9IFFk1o35z'
b'472839953752145920',05/31/2014,b'RT @queentatiana: # Bitcoin Backers Embrace Crowd Funding w \xe2\x80\x9cTatiana Coin\xe2\x80\x9d http://t.co/xK8vvPF4bS @tatianacoin @antiwar2 @LetsTalkBitcoin @\xe2\x80\xa6'
b'472410224780144640',05/30/2014,b'Become a kernel hacker: A guide to writing your first Linux kernel module http://t.co/ffjK6MA0nJ'
